<?xml version="1.0" encoding="UTF-8"?>
<lindberg-configuration xmlns="http://www.lindbergframework.org/schema" 
	xmlns:xsi="http://www.w3.org/2001/XMLSchema-instance" 
	xsi:schemaLocation="http://www.lindbergframework.org/schema lindberg-config.xsd ">

<core>
   <config-property name="lindberg.core.di-basepackage" value="org.lindbergframework.exemplo"/>
</core>

<linp>
	<dataSource
		class="org.springframework.jdbc.datasource.DriverManagerDataSource"
		driver="oracle.jdbc.OracleDriver" driverPropertyName="driverClassName">
		<property name="url" value="jdbc:oracle:thin:@localhost:1521:xe" />
		<property name="username" value="SYSTEM" />
		<property name="password" value="admin" />
	</dataSource>

	<config-properties>
		<config-property name="lindberg.persistence.IntegerCursorType"
			value="#oracle.jdbc.OracleTypes.CURSOR" />
		<config-property name="lindberg.persistence.SqlCommandResolver"
			value="org.lindbergframework.persistence.sql.ClassPathXmlSqlCommandResolver">
			<property constructor-arg="true">
				<array>
					org/lindbergframework/exemplo/sql/exemploQueries.xml;
					org/lindbergframework/exemplo/sql/exemploUpdates.xml
				</array>
			</property>
		</config-property>
	</config-properties>

</linp>

</lindberg-configuration>
