<?xml version="1.0" encoding="UTF-8"?>
<lindberg-configuration xmlns="http://www.lindbergframework.org/schema" xmlns:xsi="http://www.w3.org/2001/XMLSchema-instance" xsi:schemaLocation="http://www.lindbergframework.org/schema lindberg-config.xsd ">


<core>
   <config-property name="lindberg.core.di-basepackage" value="org.lindbergframework.test.*"/>
</core>

<linp parser="org.lindbergframework.persistence.configuration.XmlLinpConfiguration">
		<dataSource class="org.springframework.jdbc.datasource.SimpleDriverDataSource" 
		    driver="#com.mysql.jdbc.Driver" >
			<property name="url" value="jdbc:mysql://localhost:3306/test" />
			<property name="username" value="root" />
			<property name="password" value="admin" />
		</dataSource>
  
		<config-properties>
			<config-property name="lindberg.persistence.DefaultSchema" value="test" />
			<config-property name="lindberg.persistence.TransactionManager" value="org.lindbergframework.persistence.transaction.LinpTransactionManager" />
			<config-property name="lindberg.persistence.SqlCommandResolver" value="org.lindbergframework.persistence.sql.ClassPathXmlSqlCommandResolver">
				<property  constructor-arg="true">
					<array> 
                       org/lindbergframework/test/persistence/resource/mysql/Updates.xml;
                       org/lindbergframework/test/persistence/resource/mysql/Queries.xml
					</array>
				</property>
			</config-property>
		</config-properties>

	</linp>

</lindberg-configuration>
